locus_id,Gene,Gene_me,Synonymns,Chro,Homologene,miRNAs,miR.PMIDs,PMID1,PMID2,PMID3,PMID4,PMID5,PMID6,PMID7,PMID8,Gene_summary,theme1,theme2,theme3,theme4,theme5,theme6,theme7,theme8,Obs,Obs2,Obs3,Obs4,Obs5,Obs6,Obs7,Obs8,Drug target,population 1,population 2,population 3,population 4,population 5,population 6
968,CD68,CD68 molecule,"GP110,  LAMP4,  SCARD1",17,955,NA,,24786705,30894181,,,,,,,"This gene encodes a 110-kD transmembrane glycoprotein that is highly expressed by human monocytes and tissue macrophages. It is a member of the lysosomal/endosomal-associated membrane glycoprotein (LAMP) family. The protein primarily localizes to lysosomes and endosomes with a smaller fraction circulating to the cell surface. It is a type I integral membrane protein with a heavily glycosylated extracellular domain and binds to tissue- and organ-specific lectins or selectins. The protein is also a member of the scavenger receptor family. Scavenger receptors typically function to clear cellular debris, promote phagocytosis, and mediate the recruitment and activation of macrophages. Altertive splicing results in multiple transcripts encoding different isoforms. [provided by RefSeq, Jul 2008]",Nephropathy,Cardiovascular,,,,,,,"1. While IL6, CCL2 and CCR5-mR, and CD68  were overexpressed in the tubulointerstitial compartment in clinical DN, they were not expressed in microalbuminuria.",1. LOX-1 and CD68 and were higher  in IHD patients with T2DM and were identified as a cardiovascular risk factor of  T2DM.,,,,,,,NA,NA,,,,,
969,CD69,CD69 molecule,"AIM,  EA1,  MLR-3,  CLEC2C,  GP32/28,  BL-AC/P26",12,128584,NA,,11749662,,,,,,,,"This gene encodes a member of the calcium dependent lectin superfamily of type II transmembrane receptors. Expression of the encoded protein is induced upon activation of T lymphocytes, and may play a role in proliferation. Furthermore, the protein may act to transmit sigls in tural killer cells and platelets. [provided by RefSeq, Aug 2011]",Nephropathy,,,,,,,,1. Neutrophils from DN were faster than neutrophils from either NC or DC to exocytose primary granules with CD69 following initial expression of the adhesion molecule CD11b.,,,,,,,,NA,NA,,,,,
972,CD74,"CD74 molecule, major histocompatibility complex, class II invariant chain","II,  DHLAG,  HLADG,  Ia-GAMMA",5,3209,NA,,18842989,,,,,,,,"The protein encoded by this gene associates with class II major histocompatibility complex (MHC) and is an important chaperone that regulates antigen presentation for immune response. It also serves as cell surface receptor for the cytokine macrophage migration inhibitory factor (MIF) which, when bound to the encoded protein, initiates survival pathways and cell proliferation. This protein also interacts with amyloid precursor protein (APP) and suppresses the production of amyloid beta (Abeta). Multiple altertively spliced transcript variants encoding different isoforms have been identified. [provided by RefSeq, Aug 2011]",Nephropathy,,,,,,,,1. These data suggest that CD74 acts as a receptor for MIF in podocytes and may play a role in the pathogenesis of diabetic nephropathy.,,,,,,,,NA,NA,,,,,
941,CD80,CD80 molecule,"B7,  BB1,  B7-1,  B7.1,  LAB7,  CD28LG,  CD28LG1",3,3804,NA,,24676639,,,,,,,,"The protein encoded by this gene is a membrane receptor that is activated by the binding of CD28 or CTLA-4. The activated protein induces T-cell proliferation and cytokine production. This protein can act as a receptor for adenovirus subgroup B and may play a role in lupus neuropathy. [provided by RefSeq, Aug 2011]",Nephropathy,,,,,,,,"1. Here, we show that the immune-related molecule B7-1/CD80 is a critical mediator of podocyte injury in type 2 diabetic nephropathy.",,,,,,,,NA,NA,,,,,
928,CD9,CD9 molecule,"MIC3,  MRP-1,  BTCC-1,  DRAP-27,  TSPAN29,  TSPAN-29",12,20420,NA,,26378766,,,,,,,,"This gene encodes a member of the transmembrane 4 superfamily, also known as the tetraspanin family. Tetraspanins are cell surface glycoproteins with four transmembrane domains that form multimeric complexes with other cell surface proteins. The encoded protein functions in many cellular processes including differentiation, adhesion, and signal transduction, and expression of this gene plays a critical role in the suppression of cancer cell motility and metastasis. [provided by RefSeq, Jan 2011]",Cardiovascular,,,,,,,,1. A therapeutic approach to upregulating CD9 in macrophages might improve the clinical course of COPD patients with comorbidities.,,,,,,,,NA,NA,,,,,
10225,CD96,CD96 molecule,TACTILE,3,68489,NA,,NA,,,,,,,,"The protein encoded by this gene belongs to the immunoglobulin superfamily. It is a type I membrane protein. The protein may play a role in the adhesive interactions of activated T and NK cells during the late phase of the immune response. It may also function in antigen presentation. Alternative splicing generates multiple transcript variants encoding distinct isoforms. [provided by RefSeq, Jan 2016]",,,,,,,,,NA,,,,,,,,NA,European,,,,,
8872,CDC123,cell division cycle,"D123,  C10orf7",10,4394,NA,,23298195,,,,,,,,"This gene is expressed in adipose tissue exclusively. It encodes a protein with similarity to collagens X and VIII and complement factor C1q. The encoded protein circulates in the plasma and is involved with metabolic and hormol processes. Mutations in this gene are associated with adiponectin deficiency. Multiple altertively spliced variants, encoding the same protein, have been identified. [provided by RefSeq, Apr 2010]",Cardiovascular,,,,,,,,"1. Variants in WFS1, CDKN2A/B, KCNJ11, CDC123/CAMK1D, JAZF1, SLC30A8, FTO, CDKAL1, and HHEX/IDE genes are significantly associated with T2DM in She Chinese subjects. JAZF1, FTO, CDKAL1, and HHEX/IDE are associated with diabetic nephropathy. WFS1, CDKN2A/B, CDC123/CAMK1D, JAZF1, FTO, CDKAL1, and HHEX/IDE are associated with cardiovascular risk",,,,,,,,NA,European,Chinese,,,,
999,CDH1,"cadherin 1, type 1","UVO,  CDHE,  ECAD,  LCAM,  Arc-1,  CD324",16,20917,NA,,"22215279 , 20682777",,,,,,,,"This gene encodes a classical cadherin of the cadherin superfamily. Altertive splicing results in multiple transcript variants, at least one of which encodes a preproprotein that is proteolytically processed to generate the mature glycoprotein. This calcium-dependent cell-cell adhesion protein is comprised of five extracellular cadherin repeats, a transmembrane region and a highly conserved cytoplasmic tail. Mutations in this gene are correlated with gastric, breast, colorectal, thyroid and ovarian cancer. Loss of function of this gene is thought to contribute to cancer progression by increasing proliferation, invasion, and/or metastasis. The ectodomain of this protein mediates bacterial adhesion to mammalian cells and the cytoplasmic domain is required for interlization. This gene is present in a gene cluster with other members of the cadherin family on chromosome 16. [provided by RefSeq, Nov 2015]",Nephropathy,,,,,,,,"1. We provide compelling evidence that TGF-beta 1-induced EMT instigates a loss of E-cadherin, cell adhesion and ultimately of connexin-mediated cell communication in the proximal tubule under diabetic conditions; these changes occur ahead of overt signs of renal damage.   	2. Decreased expression of P- and E-cadherins is implicated in podocyte dysfunction and epithelial-mesenchymal transition observed in DN. We speculate that the actions of GH on ZEB2 and P- and E-cadherin expression play a role in the pathogenesis of microalbuminuria of DN.",,,,,,,,NA,NA,,,,,
1000,CDH2,"cadherin 2, type 1, N-cadherin (neurol)","CDHN,  NCAD,  CD325,  CDw325",18,20424,NA,,22629296,,,,,,,,"This gene encodes a classical cadherin and member of the cadherin superfamily. Altertive splicing results in multiple transcript variants, at least one of which encodes a preproprotein is proteolytically processed to generate a calcium-dependent cell adhesion molecule and glycoprotein. This protein plays a role in the establishment of left-right asymmetry, development of the nervous system and the formation of cartilage and bone. [provided by RefSeq, Nov 2015]",Nephropathy,,,,,,,,"1. It was shown that CTGF, MCP-1, PAI-1, ACE, CDH1, CDH2 mRNA  varied significantly among the 3 study groups, and their mRNA  levels increased with DN progression (p<0.05).",,,,,,,,NA,NA,,,,,
1022,CDK7,cyclin-dependent kinase 7,"CAK1,  HCAK,  MO15,  STK1,  CDKN7,  p39MO15",5,1363,NA,,17416350,,,,,,,,"The protein encoded by this gene is a member of the cyclin-dependent protein kinase (CDK) family. CDK family members are highly similar to the gene products of Saccharomyces cerevisiae cdc28, and Schizosaccharomyces pombe cdc2, and are known to be important regulators of cell cycle progression. This protein forms a trimeric complex with cyclin H and MAT1, which functions as a Cdk-activating kinase (CAK). It is an essential component of the transcription factor TFIIH, that is involved in transcription initiation and D repair. This protein is thought to serve as a direct link between the regulation of transcription and the cell cycle. [provided by RefSeq, Jul 2008]",Nephropathy,,,,,,,,"1. In the kidneys of the GK rat, a model of type II diabetes, CDK7 showed a steady age-related increase in mRNA , increasing to >sixfold in 40 week GK rats compared to normoglycemic age-matched Wistar rat kidneys, this increase correlates with progressive hyperglycemia.",,,,,,,,NA,NA,,,,,
54901,CDKAL1,CDK5 regulatory subunit associated protein 1-like 1,NA,6,9830,NA,,23298195,23298195,28821857,,,,,,"The protein encoded by this gene is a member of the methylthiotransferase family. The function of this gene is not known. Genome-wide association studies have linked single nucleotide polymorphisms in an intron of this gene with susceptibilty to type 2 diabetes. [provided by RefSeq, May 2010]",Nephropathy,Cardiovascular,Retinopathy,,,,,,"1. JAZF1, FTO, CDKAL1, and HHEX/IDE are associated with diabetic nephropathy.","1. WFS1, CDKN2A/B, CDC123/CAMK1D, JAZF1, FTO, CDKAL1, and HHEX/IDE are associated with cardiovascular risk.",1. CDKAL1 rs7756992 is associated with diabetic retinopathy in a Chinese population with type 2 diabetes.,,,,,,NA,European,Indian,Japanese,Chinese,,
1026,CDKN1A,"cyclin-dependent kinase inhibitor 1A (p21, Cip1)","P21,  CIP1,  SDI1,  WAF1,  CAP20,  CDKN1,  MDA-6,  p21CIP1",6,333,NA,,12048257,9621281,,,,,,,"This gene encodes a potent cyclin-dependent kinase inhibitor. The encoded protein binds to and inhibits the activity of cyclin-CDK2 or -CDK4 complexes, and thus functions as a regulator of cell cycle progression at G1. The expression of this gene is tightly controlled by the tumor suppressor protein p53, through which this protein mediates the p53-dependent cell cycle G1 phase arrest in response to a variety of stress stimuli. This protein can interact with proliferating cell nuclear antigen (PC), a D polymerase accessory factor, and plays a regulatory role in S phase D replication and D damage repair. This protein was reported to be specifically cleaved by CASP3-like caspases, which thus leads to a dramatic activation of CDK2, and may be instrumental in the execution of apoptosis following caspase activation. Multiple altertively spliced variants have been found for this gene. [provided by RefSeq, Nov 2010]",Nephropathy,,,,,,,,"1. At the cell-cycle level, the HG-induced proliferation of MCs was associated with a decrease in cyclin dependent kinase (CDK) inhibitor p21 protein expression accompanied by an increase in CDK4 and CDK2 kinase activities.  	2. The cyclin kinase inhibitor p21WAF1, CIP1 is increased in experimental diabetic nephropathypotential role in glomerular hypertroph These results support a role for p21 in causing glomerular cell hypertrophy in diabetic nephropathy.",,,,,,,,NA,NA,,,,,
1029,CDKN2A,cyclin-dependent kin,"ARF,  MLM,  P14,  P16,  P19,",9,55430,NA,,23298195,30176239,,,,,,,"This gene generates several transcript variants which differ in their first exons. At least three altertively spliced variants encoding distinct proteins have been reported, two of which encode structurally related isoforms known to function as inhibitors of CDK4 kinase. The remaining transcript includes an alterte first exon located 20 Kb upstream of the remainder of the gene; this transcript contains an alterte open reading frame (ARF) that specifies a protein which is structurally unrelated to the products of the other variants. This ARF product functions as a stabilizer of the tumor suppressor protein p53 as it can interact with, and sequester, the E3 ubiquitin-protein ligase MDM2, a protein responsible for the degradation of p53. In spite of the structural and functional differences, the CDK inhibitor isoforms and the ARF product encoded by this gene, through the regulatory roles of CDK4 and p53 in cell cycle G1 progression, share a common functiolity in cell cycle G1 control. This gene is frequently mutated or deleted in a wide variety of tumors, and is known to be an important tumor suppressor gene. [provided by RefSeq, Sep 2012]",Cardiovascular,Atherosclerosis,,,,,,,"1. WFS1, CDKN2A/B, CDC123/CAMK1D, JAZF1, FTO, CDKAL1, and HHEX/IDE are associated with cardiovascular risk.","Thus, atherosclerosis complications in T2DM associate with altered immune cell homeostasis, diminished CDKN2A/2B/2BAS expression, and increased CDK4 levels. The present study also suggests that the treatment with drugs that mimic CDKN2A/2B genes could potential be considered as a promising therapy to delay atherosclerosis.",,,,,,,NA,European,Indian,Japanese,American,Mexican,Chinese
1030,CDKN2B,cyclin dependent kinase inhibitor 2B,"P15,MTS2,TP15,CDK4I,INK4B,p15INK4b",9,55859,NA,,30176239,,,,,,,,"This gene lies adjacent to the tumor suppressor gene CDKN2A in a region that is frequently mutated and deleted in a wide variety of tumors. This gene encodes a cyclin-dependent kinase inhibitor, which forms a complex with CDK4 or CDK6, and prevents the activation of the CDK kinases, thus the encoded protein functions as a cell growth regulator that controls cell cycle G1 progression. The expression of this gene was found to be dramatically induced by TGF beta, which suggested its role in the TGF beta induced growth inhibition. Two alternatively spliced transcript variants of this gene, which encode distinct proteins, have been reported. [provided by RefSeq, Jul 2008]",Atherosclerosis,,,,,,,,"Thus, atherosclerosis complications in T2DM associate with altered immune cell homeostasis, diminished CDKN2A/2B/2BAS expression, and increased CDK4 levels. The present study also suggests that the treatment with drugs that mimic CDKN2A/2B genes could potential be considered as a promising therapy to delay atherosclerosis",,,,,,,,NA,European,Chinese,,,,
116985,CENTD2,"ArfGAP with RhoGAP domain, ankyrin repeat and PH domain 1",CENTD2,11,12326,NA,,NA,,,,,,,,"The protein encoded by this gene contains SAM, ARF-GAP, RHO-GAP, ankyrin repeat, RAS-associating, and pleckstrin homology (PH) domains. In vitro, this protein displays RHO-GAP and phosphatidylinositol (3,4,5) trisphosphate (PIP3)-dependent ARF-GAP activity. The encoded protein associates with the Golgi, and the ARF-GAP activity mediates changes in the Golgi and the formation of filopodia. It is thought to regulate the cell-specific trafficking of a receptor protein involved in apoptosis. Multiple transcript variants encoding different isoforms have been found for this gene. [provided by RefSeq, Sep 2008]",,,,,,,,,NA,,,,,,,,NA,European,,,,,
645345,CHCHD9,coiled-coil-helix-coiled-coil-helix domain containing 2 pseudogene 9,"CHCHD9,C9orf49",9,NA,NA,,NA,,,,,,,,NA,,,,,,,,,NA,,,,,,,,NA,European,,,,,
1116,CHI3L1,chitinase 3-like 1 (cartilage glycoprotein-39),"GP39,  ASRT7,  GP-39,  YKL40,  CGP-39,  YKL-40,  YYL-40,  HC-gp3",1,55569,NA,,21696606,"22901243, 21696606, 19930630",26248552,23071724,,,,,"Chitinases catalyze the hydrolysis of chitin, which is an abundant glycopolymer found in insect exoskeletons and fungal cell walls. The glycoside hydrolase 18 family of chitinases includes eight human family members. This gene encodes a glycoprotein member of the glycosyl hydrolase 18 family. The protein lacks chitinase activity and is secreted by activated macrophages, chondrocytes, neutrophils and synovial cells. The protein is thought to play a role in the process of inflammation and tissue remodeling. [provided by RefSeq, Sep 2009]",Nephropathy,Cardiovascular,Retinopathy,Atherosclerosis,,,,,1. YKL-40 levels are elevated in patients with T2D with an independent  association between increasing YKL-40 levels and increasing levels of albuminuria. The study suggests a role of YKL-40 in the progressing vascular complications in patients with T2D.,"1. Plasma YKL-40 predicts 10-year cardiovascular and all-cause mortality in individuals with type 2 diabetes. 	2. In the present study YKL-40 levels were examined in patients with type 2 diabetes (T2D) with increasing levels of albuminuria, known to be associated with an increased risk of cardiovascular diseases. 	3-	Because we detected an association between YKL-40 with rel, micro- and macrovascular disease, this protein could play an important for the increased risk of type 2 diabetic patients with albuminuria for the development of cardiovascular disease. 4. YKL-40 an emerging biomarker in cardiovascular disease and diabetes.  5. Finally, YKL-40 levels are elevated both in patients with type 1 and type 2 diabetes, known to be at high risk for the development of cardiovascular diseases, when compared to non-diabetic persons.","1. We identified differential DNA methylation of 349 CpG sites representing 233 unique genes including TNF, CHI3L1 (also known as YKL-40), CHN2, GIPR, GLRA1, GPX1, AHRR, and BCOR in cases with PDR compared with controls.","1. The inflammatory biomarker YKL-40 seems to play a role in atherosclerosis and is elevated in patients with obesity, cardiovascular disease and type 2 diabetes.",,,,,NA,NA,,,,,
1118,CHIT1,chitinase 1,"CHI3,CHIT,CHITD",1,68318,NA,,26589000,,,,,,,,"Chitotriosidase is secreted by activated human macrophages and is markedly elevated in plasma of Gaucher disease patients. The expression of chitotriosidase occurs only at a late stage of differentiation of monocytes to activated macrophages in culture. Human macrophages can synthesize a functional chitotriosidase, a highly conserved enzyme with a strongly regulated expression. This enzyme may play a role in the degradation of chitin-containing pathogens. Several alternatively spliced transcript variants have been described for this gene. [provided by RefSeq, Jan 2012]",Nephropathy,,,,,,,,1. The immunomodulatory effects of chitotriosidase enzyme could be implicated in the development of nephropathy in type 2 diabetes.,,,,,,,,NA,NA,,,,,
1124,CHN2,chimerin 2,"BCH,  CHN2-3,  ARHGAP3,  RHOGAP3",7,31213,NA,,21127830,21911749,,,,,,,"This gene encodes a guanosine triphosphate (GTP)-metabolizing protein that contains a phorbol-ester/diacylglycerol (DAG)-type zinc finger, a Rho-GAP domain, and an SH2 domain. The encoded protein translocates from the cytosol to the Golgi apparatus membrane upon binding by diacylglycerol (DAG). Activity of this protein is important in cell proliferation and migration, and expression changes in this gene have been detected in cancers. A mutation in this gene has also been associated with schizophrenia in men. Alternative transcript splicing and the use of alternative promoters results in multiple transcript variants. [provided by RefSeq, May 2014]",Nephropathy,Retinopathy,,,,,,,"1. We identified 34 replicated genetic variants. Of these, 21 remained significantly associated with  diabetic nephropathy in a random-effects meta-analysis. These variants were in or near the following genesACE, AKR1B1 (two variants), APOC1, APOE, EPO, NOS3 (two variants), HSPG2, VEGFA, FRMD3 (two variants), CARS (two variants), UNC13B, CPVL  and CHN2, and GREM1, plus four variants not near genes. The odds ratios of associated genetic variants ranged from 0.48 to 1.70. Additional variants were detected in subgroup analysesELMO1 (Asians), CCR5 (Asians) and CNDP1 (type 2 diabetes).","1. In this study, we found CPVL/CHN2 rs39059 was associated with diabetic retinopathy in the Chinese type 2 diabetic patients.",,,,,,,NA,NA,,,,,
56994,CHPT1,choline phosphotransferase 1,"CPT,  CPT1",12,69297,NA,,15254874,,,,,,,,NA,Nephropathy,,,,,,,,1. In situ hybridization revealed the levels of glomerular putative mCHPT1 in BALB/c mice tended to be slightly higher than those in KK/Ta mice. The altered renal mRNA  expression of these genes may be involved in the development and/or progression of diabetic nephropathy.,,,,,,,,NA,NA,,,,,
1131,CHRM3,cholinergic receptor muscarinic 3,"HM3,PBS,EGBRS",1,20191,NA,,NA,,,,,,,,"The muscarinic cholinergic receptors belong to a larger family of G protein-coupled receptors. The functional diversity of these receptors is defined by the binding of acetylcholine and includes cellular responses such as adenylate cyclase inhibition, phosphoinositide degeneration, and potassium channel mediation. Muscarinic receptors influence many effects of acetylcholine in the central and peripheral nervous system. The muscarinic cholinergic receptor 3 controls smooth muscle contraction and its stimulation causes secretion of glandular tissue. [provided by RefSeq, Jul 2008]",,,,,,,,,NA,,,,,,,,NA,American,,,,,
1154,CISH,cytokine inducible SH2-containing protein,"CIS,  G18,  SOCS,  CIS-1,  BACTS2",3,7667,NA,,"24802166 , 19008912",,,,,,,,"The protein encoded by this gene contains a SH2 domain and a SOCS box domain. The protein thus belongs to the cytokine-induced STAT inhibitor (CIS), also known as suppressor of cytokine signaling (SOCS) or STAT-induced STAT inhibitor (SSI), protein family. CIS family members are known to be cytokine-inducible negative regulators of cytokine sigling. The expression of this gene can be induced by IL2, IL3, GM-CSF and EPO in hematopoietic cells. Proteasome-mediated degradation of this protein has been shown to be involved in the ictivation of the erythropoietin receptor. Multiple transcript variants encoding different isoforms have been found for this gene. [provided by RefSeq, Aug 2008]",Nephropathy,,,,,,,,"1. Suppressor of cytokine signaling (SOCS) 2 attenuates renal lesions in rats with diabetic nephropathy.Additionally, adenovirus-mediated upregulation of renal SOCS2 markedly inhibited STZ-induced phosphorylation increases of Janus kinase (JAK) 2, signal transducer and activator of transcription (STAT) 3, STAT5 and extracellular receptor-activated kinase (ERK) 1/2. the present research demonstrates that SOCS2 reduces renal lesions associated with diabetes in rats.  	2. Usin DNA microarray analysis of glomerular R from control  and diabetic rats we found that the expression levels of insulin-like growth factor 1 receptor (IGF-1R) were increased while those of suppressor of cytokine signaling 2 (SOCS2) and STAT5 were decreased.",,,,,,,,NA,NA,,,,,
10370,CITED2,Cbp/p300 interacting transactivator with Glu/Asp rich carboxy-terminal domain 2,ASD8 MRG1 VSD2 MRG-1 P35SRJ,6,4433,NA,,27561725,,,,,,,,"The protein encoded by this gene inhibits transactivation of HIF1A-induced genes by competing with binding of hypoxia-inducible factor 1-alpha to p300-CH1. Mutations in this gene are a cause of cardiac septal defects. Alternatively spliced transcript variants encoding multiple isoforms have been observed for this gene. [provided by RefSeq, May 2012]",Atherosclerosis,,,,,,,,"1. In patients with atherosclerotic complications of diabetes, impaired neovascularization of ischemic tissue in the myocardium and lower limb limits the ability of these tissues to compensate for poor perfusion. We conclude that vascular insulin resistance in type 2 diabetes contributes to the upregulation of CITED2, which impairs HIF signaling and endothelial proangiogenic function.",,,,,,,,NA,NA,,,,,
1184,CLCN5,"chloride channel, voltage-sensitive 5","XRN,  CLC5,  XLRH,  CLCK2,  ClC-5,  DENTS,  NPHL1,  NPHL2,  hCIC-K",X,73872,NA,,23029130,,,,,,,,"This gene encodes a member of the ClC family of chloride ion channels and ion transporters. The encoded protein is primarily localized to endosomal membranes and may function to facilitate albumin uptake by the renal proximal tubule. Mutations in this gene have been found in Dent disease and renal tubular disorders complicated by nephrolithiasis. Altertively spliced transcript variants have been found for this gene. [provided by RefSeq, Jan 2013]",Nephropathy,,,,,,,,1. Glomerular ClC-5 levels were significantly higher in diabetic nephropaty and MG at both mRNA  and protein level (p<0.002; p<0.01),,,,,,,,NA,NA,,,,,
6320,CLEC11A,"C-type lectin domain family 11, member A","P47,  SCGF,  LSLCL,  CLECSF3",19,2236,NA,,22653270,,,,,,,,"This gene encodes a member of the C-type lectin superfamily. The encoded protein is a secreted sulfated glycoprotein and functions as a growth factor for primitive hematopoietic progenitor cells. An altertive splice variant has been described but its biological ture has not been determined. [provided by RefSeq, Jul 2008]",Nephropathy,,,,,,,,1. Deletion of p47 (phox) attenuates diabetes-induced glomerular injury and beta cell dysfunction in the Akita mouse.,,,,,,,,NA,NA,,,,,
