locus_id,Gene,Gene_me,Synonymns,Chro,Homologene,miRNAs,miR.PMIDs,PMID1,PMID2,PMID3,PMID4,PMID5,PMID6,PMID7,PMID8,Gene_summary,theme1,theme2,theme3,theme4,theme5,theme6,theme7,theme8,Obs,Obs2,Obs3,Obs4,Obs5,Obs6,Obs7,Obs8,Drug target,population 1,population 2,population 3,population 4,population 5,population 6
5950,RBP4,"retinol binding protein 4, plasma","RDCCAS,  MCOPCB10",10,4908,NA,,17875187,17875187,26055327,23799122,,,,,"This protein belongs to the lipocalin family and is the specific carrier for retinol (vitamin A alcohol) in the blood. It delivers retinol from the liver stores to the peripheral tissues. In plasma, the RBP-retinol complex interacts with transthyretin which prevents its loss by filtration through the kidney glomeruli. A deficiency of vitamin A blocks secretion of the binding protein posttranslationally and results in defective delivery and supply to the epidermal cells. [provided by RefSeq, Jul 2008]",Nephropathy,Cardiovascular,Retinopathy,Atherosclerosis,,,,,1. Plasma RBP4 concentration might be a biomarker of nephropathy and cardiovascular disease in type 2 diabetic subjects.,1. Plasma RBP4 concentration might be a biomarker of nephropathy and cardiovascular disease in type 2 diabetic subjects.,"1. Moreover, two separate studies reported that patients with proliferative diabetic retinopathy have increased serum RBP4 levels compared to patients with mild or no retinopathy, yet the effect of increased levels of RBP4 on the retina has not been studied.","1. Circulating levels of lipocalin-2 and RBP4 are positively correlated  with carotid IMT and subclinical atherosclerosis in type 2 diabetes, which suggests a potential role of these two lipid-binding chaperones in the pathogenesis of vascular complications of diabetes",,,,,NA,NA,,,,,
1827,RCAN1,regulator of calcineurin 1,"CSP1,  DSC1,  RCN1,  DSCR1,  MCIP1,  ADAPT78",21,3251,NA,,22128263,,,,,,,,"The protein encoded by this gene interacts with calcineurin A and inhibits calcineurin-dependent signaling pathways, possibly affecting central nervous system development. This gene is located in the minimal candidate region for the Down syndrome phenotype, and is overexpressed in the brain of Down syndrome fetuses. Chronic overexpression of this gene may lead to neurofibrillary tangles such as those associated with Alzheimer disease. Altertive splicing results in multiple transcript variants. [provided by RefSeq, Nov 2013]",Nephropathy,,,,,,,,1. Stable transfection of RCAN1.4 in Mes-13 mesangial cells upregulated several factors relevant to ECM production and degradation. These  suggested that RCAN1.4 might act as a link between CaN activation and ECM turnover in diabetic nephropathy.,,,,,,,,NA,NA,,,,,
5967,REG1A,regenerating islet-derived 1 alpha,"P19,  PSP,  PTP,  REG,  ICRF,  PSPS,  PSPS1",2,68282,NA,,9678681,,,,,,,,"This gene is a type I subclass member of the Reg gene family. The Reg gene family is a multigene family grouped into four subclasses, types I, II, III and IV, based on the primary structures of the encoded proteins. This gene encodes a protein that is secreted by the exocrine pancreas. It is associated with islet cell regeneration and diabetogenesis and may be involved in pancreatic lithogenesis. Reg family members REG1B, REGL, PAP and this gene are tandemly clustered on chromosome 2p12 and may have arisen from the same ancestral gene by gene duplication. [provided by RefSeq, Jul 2008]",Nephropathy,,,,,,,,1. Urinary PSP excretion was increased from the initial stage of diabetic nephropathy and this increase became more marked as nephropathy progressed.,,,,,,,,NA,NA,,,,,
5970,RELA,v-rel avian reticuloendotheliosis viral oncogene homolog A,"p65,  NFKB3",11,32064,NA,,24936866,25835259,,,,,,,"NF-kappa-B is a ubiquitous transcription factor involved in several biological processes. It is held in the cytoplasm in an inactive state by specific inhibitors. Upon degradation of the inhibitor, NF-kappa-B moves to the nucleus and activates transcription of specific genes. NF-kappa-B is composed of NFKB1 or NFKB2 bound to either REL, RELA, or RELB. The most abundant form of NF-kappa-B is NFKB1 complexed with the product of this gene, RELA. Four transcript variants encoding different isoforms have been found for this gene. [provided by RefSeq, Sep 2011]",Nephropathy,Retinopathy,,,,,,,"1. Nuclear NF-kappa B p65 in peripheral blood mononuclear cells correlates with urinary MCP-1, RANTES and the severity of type 2 diabetic nephropathy.",1. The present data suggest that hyperglycemia increases O-GlcNAcylation in DR and that O-GlcNAcylation of the p65 subunit of NF-KappaB is involved in hyperglycemia-induced NF-KappaB activation and RGC death in DR.,,,,,,,NA,NA,,,,,
5972,REN,renin,HNFJ2,1,20151,NA,,26102248,26322175,,,,,,,"Renin catalyzes the first step in the activation pathway of angiotensinogen--a cascade that can result in aldosterone release,vasoconstriction, and increase in blood pressure. Renin, an aspartyl protease, cleaves angiotensinogen to form angiotensin I, which is converted to angiotensin II by angiotensin I converting enzyme, an important regulator of blood pressure and electrolyte balance. Transcript variants that encode different protein isoforms and that arise from alternative splicing and the use of alternative promoters have been described, but their full-length nature has not been determined. Mutations in this gene have been shown to cause familial hyperproreninemia. [provided by RefSeq, Jul 2008]",Cardiovascular,Atherosclerosis,,,,,,,"1. The data suggest that the REN C4280A (rs5705) polymorphism plays an important role in the risk of developing CAD with the highest risk for C allele, but do not support its role as a risk factor for developing restenosis after coronary stenting.","1. The renin-angiotensin system (RAS) also plays an important role in the advancement of atherosclerosis by influencing on physiology of the endothelium, inflammatory reactions, thrombosis, and oxidant injury[9,10]",,,,,,,NA,NA,,,,,
9104,RGN,regucalcin,"RC,  GNL,  SMP30,  HEL-S-41",X,3437,NA,,26072307,,,,,,,,"The protein encoded by this gene is a highly conserved, calcium-binding protein, that is preferentially expressed in the liver and kidney. It may have an important role in calcium homeostasis. Studies in rat indicate that this protein may also play a role in aging, as it shows age-associated down-regulation. This gene is part of a gene cluster on chromosome Xp11.3-Xp11.23. Altertive splicing results in multiple transcript variants. [provided by RefSeq, Sep 2013]",Nephropathy,,,,,,,,1. Regucalcin protein expression is reduced in DN kidney tissue and this significant change is reflected in exosomes  isolated from urine.,,,,,,,,NA,NA,,,,,
6010,RHO,reti-specific pigment protein rhodopsin,"ACT, alpha-1-antichymotrypsin,  
AACT",3,68068,NA,,15251955,,,,,,,,"Retinitis pigmentosa is an inherited progressive disease which is a major cause of blindness in western communities. It can be inherited as an autosomal domint, autosomal recessive, or X-linked recessive disorder. In the autosomal domint form,which comprises about 25% of total cases, approximately 30% of families have mutations in the gene encoding the rod photoreceptor-specific protein rhodopsin. This is the transmembrane protein which, when photoexcited, initiates the visual transduction cascade. Defects in this gene are also one of the causes of congenital statiory night blindness. [provided by RefSeq, Jul 2008]",Retinopathy,,,,,,,,1. The results suggest that there is an increase in circulatory RHO mRNA  with the severity of diabetic retinopathy.,,,,,,,,NA,NA,,,,,
387,RHOA,ras homolog family member A,"ARHA,  ARH12,  RHO12,  RHOH12",3,68986,NA,,20655903,,,,,,,,"This gene encodes a member of the Rho family of small GTPases, which cycle between ictive GDP-bound and active GTP-bound states and function as molecular switches in signal transduction cascades. Rho proteins promote reorganization of the actin cytoskeleton and regulate cell shape, attachment, and motility. Overexpression of this gene is associated with tumor cell proliferation and metastasis. Multiple altertively spliced variants have been identified. [provided by RefSeq, Sep 2015]",Neuropathy,,,,,,,,1. Findings on the association between the spil RhoA/ROCK pathway and diabetic painful neuropathy may lead to  new strategies for its treatment.,,,,,,,,NA,NA,,,,,
29984,RHOD,ras homolog family member D,"Rho,  ARHD,  RHOM,  RHOHP1",11,22409,NA,,"23615507 , 23552123 , 21076299 , 20962741 , 18083785 , 17511984 , 24463961",,,,,,,,"Ras homolog, or Rho, proteins interact with protein kinases and may serve as targets for activated GTPase. They play a critical role in muscle differentiation. The protein encoded by this gene binds GTP and is a member of the small GTPase superfamily. It is involved in endosome dymics and reorganization of the actin cytoskeleton, and it may coordite membrane transport with the function of the cytoskeleton. Two transcript variants encoding different isoforms have been found for this gene. [provided by RefSeq, Jul 2014]",Nephropathy,,,,,,,,"1. Rho-kinase inhibition prevents the progression of diabetic nephropathy by downregulating hypoxia-inducible factor 1 alpha. The small GTPase Rho and its effector Rho-kinase are involved in the pathogenesis of diabetic nephropathy. Thus, we found a previously unrecognized renoprotective mechanism for the effects of Rho-kinase inhibition and this could be a potential therapeutic target for the treatment of diabetic nephropathy.  	2. The RhoA-Rho kinase (ROCK) pathway contributes to a number of diabetic complications including cardiomyopathy and nephropathy.  	3 . Rho kinase inhibition in diabetic nephropathy.  4.  Rho kinase inhibition protects kidneys from diabetic nephropathy without reducing blood pressure.  5.	  Targeting of RhoA/ROCK signaling ameliorates progression of diabetic nephropathy  independent of glucose control.  6.	   We conclude that suppression of the Rho/Rho-kinase pathway could be a new strategy for the treatment of diabetic nephropathy.  7. Rho kinase plays an important role in the  development of diabetic nephropathy by inducing glomerular and tubulointerstitial fibrosis.",,,,,,,,NA,NA,,,,,
58480,RHOU,ras homolog family member U,"ARHU,G28K,WRCH1,hG28K,CDC42L1",1,49663,NA,,NA,,,,,,,,"This gene encodes a member of the Rho family of GTPases. This protein can activate PAK1 and JNK1, and can induce filopodium formation and stress fiber dissolution. It may also mediate the effects of WNT1 signaling in the regulation of cell morphology, cytoskeletal organization, and cell proliferation. A non-coding transcript variant of this gene results from naturally occurring read-through transcription between this locus and the neighboring DUSP5P (dual specificity phosphatase 5 pseudogene) locus.[provided by RefSeq, Mar 2011]",,,,,,,,,NA,,,,,,,,NA,Indian,,,,,
22999,RIMS1,regulating synaptic membrane exocytosis 1,"RIM,RIM1,CORD7,RAB3IP2",6,128399,NA,,NA,,,,,,,,"The protein encoded by this gene is a RAS gene superfamily member that regulates synaptic vesicle exocytosis. This gene also plays a role in the regulation of voltage-gated calcium channels during neurotransmitter and insulin release. Mutations have suggested a role cognition and have been identified as the cause of cone-rod dystrophy type 7. Multiple transcript variants encoding different isoforms have been described for this gene. [provided by RefSeq, Mar 2012]",,,,,,,,,NA,,,,,,,,NA,European,,,,,
9921,RNF10,ring finger protein 10,RIE2,12,40990,NA,,NA,,,,,,,,"The protein encoded by this gene contains a ring finger motif, which is known to be involved in protein-protein interactions. The specific function of this protein has not yet been determined. EST data suggests the existence of multiple alternatively spliced transcript variants, however, their full length nature is not known. [provided by RefSeq, Jul 2008]",,,,,,,,,NA,,,,,,,,NA,American,,,,,
55328,RNLS,"relase, FAD-dependent amine oxidase","C10orf59,  RELASE",10,41254,NA,,21964580,,,,,,,,"Relase is a flavin adenine dinucleotide-dependent amine oxidase that is secreted into the blood from the kidney (Xu et al., 2005 [PubMed 15841207]).[supplied by OMIM, Mar 2008]",Cardiovascular,,,,,,,,1. To confirm observed association we later genotyped 130 stroke patients without diabetes. The OR for risk allele was 1.79 (95% CI 1.33-2. 41). The relase gene polymorphism was associated with hypertension in type 2 diabetes patients.,,,,,,,,NA,NA,,,,,
6093,ROCK1,"Rho-associated, coiled-coil containing protein kinase 1","ROCK-I,  P160ROCK",18,55899,NA,,22326220,,,,,,,,"This gene encodes a protein serine/threonine kinase that is activated when bound to the GTP-bound form of Rho. The small GTPase Rho regulates formation of focal adhesions and stress fibers of fibroblasts, as well as adhesion and aggregation of platelets and lymphocytes by shuttling between the ictive GDP-bound form and the active GTP-bound form. Rho is also essential in cytokinesis and plays a role in transcriptional activation by serum response factor. This protein, a downstream effector of Rho, phosphorylates and activates LIM kinase, which in turn, phosphorylates cofilin, inhibiting its actin-depolymerizing activity. [provided by RefSeq, Jul 2008]",Nephropathy,,,,,,,,"1. Several lines of evidence suggest that mitochondrial dysfunction plays a critical role in the pathogenesis of microvascular complications of diabetes, including diabetic nephropathy. Importantly, we found that ROCK1 triggers mitochondrial fission by phosphorylating Drp1 at serine 600 residue. These findings provide insights into the unexpected role of ROCK1 in a signaling  cascade that regulates mitochondrial dymics.",,,,,,,,NA,NA,,,,,
9475,ROCK2,Rho associated coiled-coil containing protein kinase 2,ROCK-II,2,21010,NA,,25752964,,,,,,,,"The protein encoded by this gene is a serine/threonine kinase that regulates cytokinesis, smooth muscle contraction, the formation of actin stress fibers and focal adhesions, and the activation of the c-fos serum response element. This protein, which is an isozyme of ROCK1 is a target for the small GTPase Rho. [provided by RefSeq, Jul 2008]",Atherosclerosis,,,,,,,,"1. both Rho kinase signaling and oxidative stress are involved in the pathogenesis of a number of human diseases, such as diabetes mellitus, hypertension, and atherosclerosis.",,,,,,,,NA,NA,,,,,
140823,ROMO1,reactive oxygen species modulator 1,"MTGM,  MTGMP,  C20orf52,  bA353C18.2",20,7096,NA,,25824963,,,,,,,,"The protein encoded by this gene is a mitochondrial membrane protein that is responsible for increasing the level of reactive oxygen species (ROS) in cells. The protein also has antimicrobial activity against a variety of bacteria by inducing bacterial membrane breakage. [provided by RefSeq, Nov 2014]",Retinopathy,,,,,,,,1. The rs6060566 polymorphism of the Romo-1 gene was found to be an independent risk factor for DR in Caucasians with T2DM.,,,,,,,,NA,NA,,,,,
6206,RPS12,ribosomal protein S12,S12,6,110750,NA,,21150874,,,,,,,,"Ribosomes, the organelles that catalyze protein synthesis, consist of a small 40S subunit and a large 60S subunit. Together these subunits are composed of 4 R species and approximately 80 structurally distinct proteins. This gene encodes a ribosomal protein that is a component of the 40S subunit. The protein belongs to the S12E family of ribosomal proteins. It is located in the cytoplasm. Increased expression of this gene in colorectal cancers compared to matched normal colonic mucosa has been observed. As is typical for genes encoding ribosomal proteins, there are multiple processed pseudogenes of this gene dispersed through the genome. [provided by RefSeq, Jul 2008]",Nephropathy,,,,,,,,"1. including RPS12, LIMK2, and SFI1 are strong candidates for diabetic nephropathy.",,,,,,,,NA,NA,,,,,
6194,RPS6,ribosomal protein S6,S6,9,85949,NA,,20332614,,,,,,,,"Ribosomes, the organelles that catalyze protein synthesis, consist of a small 40S subunit and a large 60S subunit. Together these subunits are composed of 4 R species and approximately 80 structurally distinct proteins. This gene encodes a cytoplasmic ribosomal protein that is a component of the 40S subunit. The protein belongs to the S6E family of ribosomal proteins. It is the major substrate of protein kinases in the ribosome, with subsets of five C-termil serine residues phosphorylated by different protein kinases. Phosphorylation is induced by a wide range of stimuli, including growth factors, tumor-promoting agents, and mitogens. Dephosphorylation occurs at growth arrest. The protein may contribute to the control of cell growth and proliferation through the selective translation of particular classes of mR. As is typical for genes encoding ribosomal proteins, there are multiple processed pseudogenes of this gene dispersed through the genome. [provided by RefSeq, Jul 2008]",Nephropathy,,,,,,,,"1. These findings suggest the possibility that resveratrol exerts antiproliferative, antihypertrophic effects by activating AMPK and reducing 4E-BP1 and S6 phosphorylation, thus suppressing the development and progression of DN.",,,,,,,,NA,NA,,,,,
27330,RPS6KA6,ribosomal protein S6 kinase A6,"RSK4,  PP90RSK4",X,22816,NA,,15615695,,,,,,,,"This gene encodes a member of ribosomal S6 kinase family, serine-threonine protein kinases which are regulated by growth factors. The encoded protein may be distinct from other members of this family, however, as studies suggest it is not growth factor dependent and may not participate in the same signaling pathways. [provided by RefSeq, Jan 2010]",Neuropathy,,,,,,,,"1. RSK4 and PAK5 may provide a molecular ratiole for late-stage complications in disease, and further studies are warranted to explore these targets for the treatment of diabetic nephro- and neuropathy, frequently seen in  patients with HNF4alpha dysfunction.",,,,,,,,NA,NA,,,,,
6239,RREB1,ras responsive element binding protein 1,"HNT,  FINB,  LZ321,  Zep-1,  RREB-1",6,2218,NA,,25027322,,,,,,,,"The protein encoded by this gene is a zinc finger transcription factor that binds to RAS-responsive elements (RREs) of gene promoters. It has been shown that the calcitonin gene promoter contains an RRE and that the encoded protein binds there and increases expression of calcitonin, which may be involved in RaRaf-mediated cell differentiation. Multiple transcript variants encoding several different isoforms have been found for this gene. [provided by RefSeq, Dec 2009]",Nephropathy,,,,,,,,"1. We posit that variants in RREB1 modulate seemingly disparate phenotypes (i.e. T2D, T2D-ESKD and non-T2D-ESKD) through altered activity ing from splice site and missense variants.",,,,,,,,NA,NA,,,,,
6252,RTN1,reticulon 1,NSP,14,49654,NA,,26496126,,,,,,,,"This gene belongs to the family of reticulon encoding genes. Reticulons are associated with the endoplasmic reticulum, and are involved in neuroendocrine secretion or in membrane trafficking in neuroendocrine cells. This gene is considered to be a specific marker for neurological diseases and cancer, and is a potential molecular target for therapy. Alternative splicing results in multiple transcript variants. [provided by RefSeq, Jul 2011]",Nephropathy,,,,,,,,"1. Three intronic RTN1 variants were nominally associated with T2D-ESKD in both discovery and replication analyses: rs1952034, rs12431381 and rs12434215 (additive models); combined T2D-ESKD (discovery+replication) p values were 0.015-3.0?10(-4) (ORs 0.67-0.77; minor alleles protective).Evidence of genetic association between common variants in RTN1 and ESKD in AAs(African Americans) and Eas(European American).",,,,,,,,NA,NA,,,,,
6283,S100A12,S100 calcium binding,"p6,  CAGC,  CGRP,  MRP6,  CA",1,48361,NA,,23609464,26132777,,,,,,,"The protein encoded by this gene is a member of the S100 family of proteins containing 2 EF-hand calcium-binding motifs. S100 proteins are localized in the cytoplasm and/or nucleus of a wide range of cells, and involved in the regulation of a number of cellular processes such as cell cycle progression and differentiation. S100 genes include at least 13 members which are located as a cluster on chromosome 1q21. This protein is proposed to be involved in specific calcium-dependent signal transduction pathways and its regulatory effect on cytoskeletal components may modulate various neutrophil activities. The protein includes an antimicrobial peptide which has antibacterial activity. [provided by RefSeq, Nov 2014]",Cardiovascular,Retinopathy,,,,,,,1. High S100A12 levels are associated with the presence and severity of coronary artery disease (CAD) in patients with T2DM.,1. The plasma levels of S100A12 are closely associated with the presence of DR and might be a better biomarker for DR and the prediction of future macrovascular events.,,,,,,,NA,NA,,,,,
6287,SAA@,serum amyloid A1 cluster,"SAA,  SAA4",11,NA,NA,,24267259,"26248570, 28596970",26339132,,,,,,NA,Nephropathy,Cardiovascular,Retinopathy,,,,,,1. SAA was increased in type 2 diabetic patients with incipient or overt nephropathy and SAA was associated with impairment of SR-BI-mediated cholesterol efflux to serum. SAA was significantly increased in diabetic patients with incipient or overt nephropathy.,"1. In patients with low SAA, higher HDL-C was associated with lower all-cause and cardiovascular mortality. 2. The association of HDL with SAA leads to a change in its protein and lipid composition, and potentially causes the HDL molecule to become dysfunctional, losing several protective properties, thus promoting the development of CVD?.","1. Conditional logistic regression on matched paired data revealed that subjects in the top quartile for sTNFR-I (OR =  2.13), sTNFR-II (OR = 1.66), sgp130 (OR = 1.82), sIL6R (OR = 1.75), sVCAM1 (OR =  1.98), sICAM1 (OR = 2.23), CRP (OR = 2.40) and SAA (OR = 2.03), had the highest odds of having DR.",,,,,,NA,NA,,,,,
6288,SAA1,serum amyloid A1,"SAA,  PIG4,  SAA2,  TP53I4",11,128033,NA,,22885250,26339132,,,,,,,"This gene encodes a member of the serum amyloid A family of apolipoproteins. The encoded preproprotein is proteolytically processed to generate the mature protein. This protein is a major acute phase protein that is highly expressed in response to inflammation and tissue injury. This protein also plays an important role in HDL metabolism and cholesterol homeostasis. High levels of this protein are associated with chronic inflammatory diseases including atherosclerosis, rheumatoid arthritis, Alzheimer&apos;s disease and Crohn&apos;s disease. This protein may also be a potential biomarker for certain tumors. Alternate splicing results in multiple transcript variants that encode the same protein. A pseudogene of this gene is found on chromosome 11. [provided by RefSeq, Feb 2016]",Nephropathy,Retinopathy,,,,,,,"1. SAA and CRP baseline levels predicted development of micro- and macroalbuminuria during 30 years of follow up, supporting the theory that inflammation is involved in the progression of diabetic nephropathy.","1. Conditional logistic regression on matched paired data revealed that subjects in the top quartile for sTNFR-I (OR =  2.13), sTNFR-II (OR = 1.66), sgp130 (OR = 1.82), sIL6R (OR = 1.75), sVCAM1 (OR =  1.98), sICAM1 (OR = 2.23), CRP (OR = 2.40) and SAA (OR = 2.03), had the highest odds of having DR.",,,,,,,NA,NA,,,,,
55811,SAC,"adenylate cyclase 10, soluble","SAC,HCA2,SACI,Sacy,hsAC,HEL-S-7a",1,10188,NA,,NA,,,,,,,,"The protein encoded by this gene belongs to a distinct class of adenylyl cyclases that is soluble and insensitive to G protein or forskolin regulation. Activity of this protein is regulated by bicarbonate. Variation at this gene has been observed in patients with absorptive hypercalciuria. Alternatively spliced transcript variants encoding different isoforms have been observed. There is a pseudogene of this gene on chromosome 6. [provided by RefSeq, Jul 2014]",,,,,,,,,NA,,,,,,,,NA,Chinese,,,,,
401474,SAMD12,sterile alpha motif domain containing 12,NA,8,35979,NA,,NA,,,,,,,,NA,,,,,,,,,NA,,,,,,,,NA,European,,,,,
1757,SARDH,sarcosine dehydrogenase,"SAR,  SDH,  SARD,  BPR-2,  DMGDHL1",9,5149,NA,,12615520,,,,,,,,"This gene encodes an enzyme localized to the mitochondrial matrix which catalyzes the oxidative demethylation of sarcosine. This enzyme is distinct from another mitochondrial matrix enzyme, dimethylglycine dehydrogenase, which catalyzes a reaction resulting in the formation of sarcosine. Mutations in this gene are associated with sarcosinemia. Altertively spliced transcript variants have been described. [provided by RefSeq, Oct 2008]",Retinopathy,,,,,,,,"1. polymorphisms of SDH gene may be correlated with SDH gene expression levels in diabetic retis, thus being a valuable genetic marker for diabetic retinopathy",,,,,,,,NA,NA,,,,,
6307,SC4MOL,methylsterol monooxygenase 1,"DESP4,ERG25,MCCPD,SC4MOL",4,133932,NA,,NA,,,,,,,,"Sterol-C4-mehtyl oxidase-like protein was isolated based on its similarity to the yeast ERG25 protein. It contains a set of putative metal binding motifs with similarity to that seen in a family of membrane desaturases-hydroxylases. The protein is localized to the endoplasmic reticulum membrane and is believed to function in cholesterol biosynthesis. Alternatively spliced transcript variants encoding distinct isoforms have been found for this gene. [provided by RefSeq, Jul 2008]",,,,,,,,,NA,,,,,,,,NA,American,,,,,
58506,SCAF1,SR-related CTD-associated factor 1,SRA1,19,10442,NA,,15530905,,,,,,,,NA,Atherosclerosis,,,,,,,,1. Glycoxidized LDL was able to significantly induce SR-A and CD36 expression by 3- and 4.5-fold.Glycoxidized LDL might be an important candidate in the initiation of foam cell formation and might play a significant role in the pathogenesis of atherosclerosis in diabetes mellitus.,,,,,,,,NA,NA,,,,,
