locus_id,Gene,Gene_me,Synonymns,Chro,Homologene,miRNAs,miR.PMIDs,PMID1,PMID2,PMID3,PMID4,PMID5,PMID6,PMID7,PMID8,Gene_summary,theme1,theme2,theme3,theme4,theme5,theme6,theme7,theme8,Obs,Obs2,Obs3,Obs4,Obs5,Obs6,Obs7,Obs8,Drug target,population 1,population 2,population 3,population 4,population 5,population 6
3480,IGF1R,insulin like growth factor 1 receptor,"IGFR,  CD221,  IGFIR,  JTK13",15,30997,NA,,24379526,30254418,,,,,,,"This receptor binds insulin-like growth factor with a high affinity. It has tyrosine kinase activity. The insulin-like growth factor I receptor plays a critical role in transformation events. Cleavage of the precursor generates alpha and beta subunits. It is highly overexpressed in most malignt tissues where it functions as an anti-apoptotic agent by enhancing cell survival. Altertively spliced transcript variants encoding distinct isoforms have been found for this gene. [provided by RefSeq, May 2014]",Retinopathy,Nephropathy,,,,,,,"1. our study indicated IGF1 and IGF1R differential expression in ERMs, but not in PBMCs, of diabetic and nondiabetic patients, suggesting that these factors can be involved in the pathogenesis or progression of proliferative vitreoretinal disorders.",1. Inhibition of IGF1R was a more effective choice for inflammation treatment than Ben or Ins in diabetic kidney disease (DKD). The IGF1R inhibitor blocked pathological changes induced by the over-expression of IGF1 in DKD without up-regulating SOCS2 protein levels.,,,,,,,NA,NA,,,,,
3481,IGF2,insulin-like growth factor 2 (somatomedin A),"IGF-II, PP9974, C11orf43",11,510,NA,,20929508,11440279,10023126,,,,,,"This gene encodes a member of the insulin family of polypeptide growth factors, which are involved in development and growth. It is an imprinted gene, expressed only from the paterl allele, and epigenetic changes at this locus are associated with Wilms tumour, Beckwith-Wiedemann syndrome, rhabdomyosarcoma, and Silver-Russell syndrome. A read-through INS-IGF2 gene exists, whose 5&apos; region overlaps the INS gene and the 3&apos; region overlaps this gene. Altertively spliced transcript variants encoding different isoforms have been found for this gene. [provided by RefSeq, Oct 2010]",Nephropathy,Retinopathy,Neuropathy,,,,,,"1. The  suggest the following molecular etiopathophysiology of DN(i) hyperglycemia upregulates IGF2, which initiates PTEN, a regulator of IGF2 sigling; (ii) loss of this IGF2-PTEN feedback loop causes changes that are characteristic of DN; and (iii) lowered expression of the repair modulator SPARC  in the development and/or progression of DN. Hence, targeting relevant modulators, such as like IGF2, PTEN, and SPARC, may be important in the magement of DN.","1. IGF-I, IGF-II, IGF-BP3 and albumin were determined by immunological methods and were confirmed to be increased in patients with PDR compared to controls.","1. Studies with NGF, NT-3, IGF-I and IGF-II both in vitro and in animal models of neuropathies (including DPN) suggest that these factors ameliorate nerve degeneration.",,,,,,NA,NA,,,,,
10644,IGF2BP2,insulin like growth factor 2 mRNA  binding protein 2,"IMP2,IMP-2,VICKZ2",3,4774,NA,,NA,,,,,,,,"This gene encodes a member of the IGF-II mRNA -binding protein (IMP) family. The protein encoded by this gene contains four KH domains and two RRM domains. It functions by binding to the 5&apos; UTR of the insulin-like growth factor 2 (IGF2) mRNA  and regulating IGF2 translation. Alternative promoter usage and alternate splicing result in multiple variants encoding different isoforms. [provided by RefSeq, May 2014]",,,,,,,,,NA,,,,,,,,NA,European,Indian,Japanese,American,,
3484,IGFBP1,insulin like growth factor binding protein 1,"AFBP,  IBP1,  PP12,  IGF-BP25,  hIGFBP-1",7,498,NA,,16306374,,,,,,,,"This gene is a member of the insulin-like growth factor binding protein (IGFBP) family and encodes a protein with an IGFBP domain and a thyroglobulin type-I domain. The protein binds both insulin-like growth factors (IGFs) I and II and circulates in the plasma. Binding of this protein prolongs the half-life of the IGFs and alters their interaction with cell surface receptors. [provided by RefSeq, Jul 2008]",Nephropathy,,,,,,,,1. The first genomic markers to be associated with diabetic microvascular complications within the human IGFBP1 gene.,,,,,,,,NA,NA,,,,,
3485,IGFBP2,insulin like growth factor binding protein 2,"IBP2,IGF-BP53",2,499,NA,,NA,,,,,,,,"The protein encoded by this gene is one of six similar proteins that bind insulin-like growth factors I and II (IGF-I and IGF-II). The encoded protein can be secreted into the bloodstream, where it binds IGF-I and IGF-II with high affinity, or it can remain intracellular, interacting with many different ligands. High expression levels of this protein promote the growth of several types of tumors and may be predictive of the chances of recovery of the patient. Several transcript variants, one encoding a secreted isoform and the others encoding nonsecreted isoforms, have been found for this gene. [provided by RefSeq, Sep 2015]",,,,,,,,,NA,,,,,,,,NA,Chinese,,,,,
3486,IGFBP3,insulin-like growth factor binding protein 3,"IBP3,  BP-53",7,510,NA,,22014109,,,,,,,,"This gene is a member of the insulin-like growth factor binding protein (IGFBP) family and encodes a protein with an IGFBP domain and a thyroglobulin type-I domain. The protein forms a terry complex with insulin-like growth factor acid-labile subunit (IGFALS) and either insulin-like growth factor (IGF) I or II. In this form, it circulates in the plasma, prolonging the half-life of IGFs and altering their interaction with cell surface receptors. Alterte transcriptional splice variants, encoding different isoforms, have been characterized. [provided by RefSeq, Jul 2008]",Nephropathy,,,,,,,,"1. Insulin-like growth factor (IGF) and the insulin-like growth factor-binding protein-3 (IGFBP3) system are known to be involved in the development of experimental diabetic nephropathy, and Urinary IGFBP3 protease activity has been observed in patients with type 2 diabetes.",,,,,,,,NA,NA,,,,,
3488,IGFBP5,insulin like growth factor binding protein 5,IBP5,2,56489,NA,,26025657,,,,,,,,NA,Neuropathy,,,,,,,,1. Dysregulated IGFBP5 expression causes axon degeneration and motoneuron loss in diabetic neuropathy.,,,,,,,,NA,NA,,,,,
3490,IGFBP7,insulin like growth factor binding protein 7,"AGM,PSF,TAF,FSTL2,IBP-7,MAC25,IGFBP-7,RAMSVPS,IGFBP-7v,IGFBPRP1",4,1193,NA,,26974954,,,,,,,,"This gene encodes a member of the insulin-like growth factor (IGF)-binding protein (IGFBP) family. IGFBPs bind IGFs with high affinity, and regulate IGF availability in body fluids and tissues and modulate IGF binding to its receptors. This protein binds IGF-I and IGF-II with relatively low affinity, and belongs to a subfamily of low-affinity IGFBPs. It also stimulates prostacyclin production and cell adhesion. Alternatively spliced transcript variants encoding different isoforms have been described for this gene, and one variant has been associated with retinal arterial macroaneurysm (PMID:21835307). [provided by RefSeq, Dec 2011]",Nephropathy,,,,,,,,"TGF-beta1 enhances IGFBP7 via Smad2/4 pathways, and that IGFBP7 might be involved in the TGF-beta 1-induced tubular injury in DN",,,,,,,,NA,NA,,,,,
3551,IKBKB,inhibitor of nuclear factor kappa B kinase subunit beta,IKK2 IKKB IMD15 NFKBIKB IKK-beta,8,7782,NA,,NA,,,,,,,,"The protein encoded by this gene phosphorylates the inhibitor in the inhibitor/NF-kappa-B complex, causing dissociation of the inhibitor and activation of NF-kappa-B. The encoded protein itself is found in a complex of proteins. Several transcript variants, some protein-coding and some not, have been found for this gene. [provided by RefSeq, Sep 2011]",,,,,,,,,NA,,,,,,,,NA,American,,,,,
3557,IL1RN,interleukin 1 receptor antagonist,"DIRA, IRAP, IL1F3, IL1RA, MVCD4, IL-1RN, IL-1ra, I",2,11163,NA,,15286433,,,,,,,,"This gene encodes a member of the class II cytokine receptor family. The encoded soluble protein specifically binds to and inhibits interleukin 22 activity by blocking the interaction of interleukin 22 with its cell surface receptor. The encoded protein may be important in the regulation of inflammatory response, and has been implicated in the regulation of tumorigenesis in the colon. Altertive splicing results in multiple transcript variants encoding distinct isoforms. [provided by RefSeq, Jul 2013]",Nephropathy,,,,,,,,1. IL1B2 and IL1RN*2 genotypes of the IL-1 cluster genes are associated with diabetic nephropathy in Korean patients with type 2 DM.,,,,,,,,NA,NA,,,,,
386653,IL31,interleukin 31,IL-31,12,88541,NA,,26352837,,,,,,,,"IL31, which is made principally by activated Th2-type T cells, interacts with a heterodimeric receptor consisting of IL31RA (MIM 609510) and OSMR (MIM 601743) that is constitutively expressed on epithelial cells and keratinocytes. IL31 may be involved in the promotion of allergic skin disorders and in regulating other allergic diseases, such as asthma (Dillon et al., 2004 [PubMed 15184896]).[supplied by OMIM, Mar 2008]",Retinopathy,,,,,,,,"1. In PDR patients, vitreous IL-17A level correlated significantly with vitreous levels of IL-22 and IL-31, and especially with IL-4 and TNF alpha.",,,,,,,,NA,NA,,,,,
3565,IL4,interleukin 4,"BSF1,  IL-4,  BCGF1,  BSF-1,  BCGF-1",5,491,NA,,23771787,,,,,,,,"The protein encoded by this gene is a pleiotropic cytokine produced by activated T cells. This cytokine is a ligand for interleukin 4 receptor. The interleukin 4 receptor also binds to IL13, which may contribute to many overlapping functions of this cytokine and IL13. STAT6, a signal transducer and activator of transcription, has been shown to play a central role in mediating the immune regulatory signal of this cytokine. This gene, IL3, IL5, IL13, and CSF2 form a cytokine gene cluster on chromosome 5q, with this gene particularly close to IL13. This gene, IL13 and IL5 are found to be regulated coorditely by several long-range regulatory elements in an over 120 kilobase range on the chromosome. Two altertively spliced transcript variants of this gene encoding distinct isoforms have been reported. [provided by RefSeq, Jul 2008]",Neuropathy,,,,,,,,1. The results of this study suggested that intron 3 VNTR polymorphism of the IL-4 gene plays an important role in the occurrence of DPN in the Turkish population.,,,,,,,,NA,NA,,,,,
3570,IL6R,interleukin 6 receptor,"IL6Q,gp80,CD126,IL6RA,IL6RQ,IL-6RA,IL-6R-1",1,474,NA,,30674322,,,,,,,,"This gene encodes a subunit of the interleukin 6 (IL6) receptor complex. Interleukin 6 is a potent pleiotropic cytokine that regulates cell growth and differentiation and plays an important role in the immune response. The IL6 receptor is a protein complex consisting of this protein and interleukin 6 signal transducer (IL6ST/GP130/IL6-beta), a receptor subunit also shared by many other cytokines. Dysregulated production of IL6 and this receptor are implicated in the pathogenesis of many diseases, such as multiple myeloma, autoimmune diseases and prostate cancer. Alternatively spliced transcript variants encoding distinct isoforms have been reported. A pseudogene of this gene is found on chromosome 9.[provided by RefSeq, May 2011]",Atherosclerosis,,,,,,,,"1. Using network analysis, we have identified several cellular network proteins like PTPN1, AKT1, INSR, LEPR, IRS1, IRS2, IL1R2, IL6R, PCSK9 and MYD88, which are responsible for regulating inflammation, insulin resistance, and atherosclerosis. We have identified three distinct sets of serum markers for diabetes, CAD and diabetes associated with CAD in Indian patients using nonparametric-based machine learning approach. These multiple marker classifiers may be useful for monitoring progression from a healthy person to T2DM and T2DM to T2DM_CAD.",,,,,,,,NA,Chinese,,,,,
3611,ILK,integrin-linked kinase,"P59,  ILK-1,  ILK-2,  p59ILK,  HEL-S-28",11,3318,NA,,11696434,,,,,,,,"This gene encodes a protein with a kinase-like domain and four ankyrin-like repeats. The encoded protein associates at the cell membrane with the cytoplasmic domain of beta integrins, where it regulates integrin-mediated signal transduction. Activity of this protein is important in the epithelial to mesenchymal transition, and over-expression of this gene is implicated in tumor growth and metastasis. Altertive splicing results in multiple transcript variants. [provided by RefSeq, Jun 2013]",Nephropathy,,,,,,,,1. Future studies aimed at defining the molecular mechanism by which ILK functions in kidney mesangial and visceral epithelial cells will likely help us to better understand the pathogenesis of diabetic nephropathy as well as other renal diseases associated with glomerulosclerosis.,,,,,,,,NA,NA,,,,,
3630,INS,insulin,"IDDM,  ILPR,  IRDN,  IDDM1,  IDDM2,  MODY10",11,173,miRNA33b/16,27301461,26446829,26383994,26439243,31013502,,,,,"After removal of the precursor signal peptide, proinsulin is post-translationally cleaved into three peptidesthe B chain and A chain peptides, which are covalently linked via two disulfide bonds to form insulin, and C-peptide. Binding of insulin to the insulin receptor (INSR) stimulates glucose uptake. A multitude of mutant alleles with phenotypic effects have been identified. There is a read-through gene, INS-IGF2, which overlaps with this gene at the 5&apos; region and with the IGF2 gene at the 3&apos; region. Alternative splicing results in multiple transcript variants. [provided by RefSeq, Jun 2010]",Cardiovascular,Retinopathy,Atherosclerosis,Neuropathy,,,,,1. Insulin treatment in these DM patients was associated with a significantly higher short and long-term adverse cardiovascular outcomes after PCI compared to those DM patients not treated by insulin therapy.,"1. Duration of diabetes, age at diagnosis, and insulin treatment were associated with increasing risk of incidence and progression of DR.","1. Both postprandial hyperlipidemia and hyperinsulinemia have been thought to play an important role in the development of atherosclerosis, and to be a potent risk  factor for cardiovascular event.","1. Exercise training improves the whole body metabolic health in patients with T2DM, leading to an increase in glycolipid uptake and utilization, improved insulin sensitivity, optimized body mass index, and modulated DNA methylation, etc.",,,,,NA,American,Indian,Japanese,,,
3654,IRAK1,interleukin 1 receptor associated kinase 1,"IRAK,  pelle",X,37496,NA,,24316060,,,,,,,,"This gene encodes the interleukin-1 receptor-associated kinase 1, one of two putative serine/threonine kinases that become associated with the interleukin-1 receptor (IL1R) upon stimulation. This gene is partially responsible for IL1-induced upregulation of the transcription factor NF-kappa B. Altertively spliced transcript variants encoding different isoforms have been found for this gene. [provided by RefSeq, Jul 2008]",Neuropathy,,,,,,,,"1. Treatment of diabetic peripheral neuropathy with sildefil, a phosphodiesterase type 5 inhibitor, augmentedMiRNA-146a expression and decreased levels of IRAK1 and TRAF6 in the DRG neurons. In vitro, blockage ofMiRNA-146a in DRG neurons abolished the effect of sildefil on DRG neuron protection and downregulation of IRAK1 and TRAF6 proteins under hyperglycemia. Our data provide the first evidence showing thatMiRNA-146a plays an important role in mediating DRG neuron apoptosis under hyperglycemic conditions.",,,,,,,,NA,European,Amercian,Mexican,,,
51135,IRAK4,interleukin 1 receptor associated kinase 4,"IPD1,REN64,IRAK-4,NY-REN-64",12,41109,NA,,27158377,,,,,,,,"This gene encodes a kinase that activates NF-kappaB in both the Toll-like receptor (TLR) and T-cell receptor (TCR) signaling pathways. The protein is essential for most innate immune responses. Mutations in this gene result in IRAK4 deficiency and recurrent invasive pneumococcal disease. Multiple transcript variants encoding different isoforms have been found for this gene. [provided by RefSeq, Aug 2011]",Atherosclerosis,,,,,,,,1.The activation of IRAK4 phenotypically modulated VSMCs from differentiation to dedifferentiation. Inactivation of IRAK4 exerts a protective effect on VSMCs differentiation and inhibits inflammation. IRAK4 could therefore be a target for interventions to prevent and treat the initial phase of atherosclerosis.,,,,,,,,NA,NA,,,,,
3667,IRS1,insulin receptor substrate 1,HIRS-1,2,4049,miR-144,24497980,22266116,30674322,,,,,,,"This gene encodes a protein which is phosphorylated by insulin receptor tyrosine kinase. Mutations in this gene are associated with type II diabetes and susceptibility to insulin resistance. [provided by RefSeq, Nov 2009]",Retinopathy,Atherosclerosis,,,,,,,"1. The goal of this present study was to investigate a potential mechanism for retinal endothelial cell apoptosis in response to hyperglycemia.Increased TNF-alpha inhibits insulin signaling in 2 ways1) increased phosphorylation of IRS-1(Ser307), 2) increased SOCS3 levels to decrease total IRS-1 and increase IR(Tyr960), both of which block normal insulin signal transduction.","1. Using network analysis, we have identified several cellular network proteins like PTPN1, AKT1, INSR, LEPR, IRS1, IRS2, IL1R2, IL6R, PCSK9 and MYD88, which are responsible for regulating inflammation, insulin resistance, and atherosclerosis. We have identified three distinct sets of serum markers for diabetes, CAD and diabetes associated with CAD in Indian patients using nonparametric-based machine learning approach. These multiple marker classifiers may be useful for monitoring progression from a healthy person to T2DM and T2DM to T2DM_CAD.",,,,,,,NA,Chinese,,,,,
8660,IRS2,insulin receptor substrate 2,IRS-2,13,2778,NA,,23617393,21984580,21754917,,,,,,"This gene encodes the insulin receptor substrate 2, a cytoplasmic signaling molecule that mediates effects of insulin, insulin-like growth factor 1, and other cytokines by acting as a molecular adaptor between diverse receptor tyrosine kinases and downstream effectors. The product of this gene is phosphorylated by the insulin receptor tyrosine kinase upon receptor stimulation, as well as by an interleukin 4 receptor-associated kinase in response to IL4 treatment. [provided by RefSeq, Jul 2008]",Nephropathy,Atherosclerosis,Neuropathy,,,,,,1. The specific up-regulation of IRS2 in the kidney tubules of DN patients also indicates a novel role for IRS2 as a marker and/or mediator of human DN progression.,1. Systemic insulin resistance and subclinical atherosclerosis are associated with decreased IRS2 and TIMP3 expression in circulating monocytes.,"1. Phosphorylation of Ser(731)IRS2 was significantly elevated in DRG neurons from type 1 and type 2 diabetic mice. Additionally, Akt activation and neurite outgrowth in response to insulin were significantly decreased in DRG  cultures from diabetic ob/ob mice. These  suggest that DRG neurons express IRS proteins that are altered by diabetes similar to other peripheral tissues, and insulin signaling downstream of the insulin receptor may be impaired in sensory neurons and contribute to the pathogenesis of diabetic neuropathy.",,,,,,NA,NA,,,,,
3673,ITGA2,integrin subunit alpha 2,"BR,  GPIa,  CD49B,  HPA-5,  VLA-2,  VLAA2",5,1662,NA,,23776381,,,,,,,,"This gene encodes the alpha subunit of a transmembrane receptor for collagens and related proteins. The encoded protein forms a heterodimer with a beta subunit and mediates the adhesion of platelets and other cell types to the extracellular matrix. Loss of the encoded protein is associated with bleeding disorder platelet-type 9. Antibodies against this protein are found in several immune disorders, including neotal alloimmune thrombocytopenia. This gene is located adjacent to a related alpha subunit gene. Altertive splicing results in multiple transcript variants. [provided by RefSeq, Aug 2012]",Retinopathy,,,,,,,,1. A significant association between the G894T polymorphism of eNOS and BgI II polymorphism of ITGA2 genes and DR was observed,,,,,,,,NA,European,Japanese,Chinese,,,
3684,ITGAM,"integrin, alpha M (complement component 3 receptor 3 subunit)","CR3A,  MO1A,  CD11B,  MAC-1,  MAC1A,  SLEB6",16,526,NA,,16617732,24205223,,,,,,,"This gene encodes the integrin alpha M chain. Integrins are heterodimeric integral membrane proteins composed of an alpha chain and a beta chain. This I-domain containing alpha integrin combines with the beta 2 chain (ITGB2) to form a leukocyte-specific integrin referred to as macrophage receptor 1 (&apos;Mac-1&apos;), or inactivated-C3b (iC3b) receptor 3 (&apos;CR3&apos;). The alpha M beta 2 integrin is important in the adherence of neutrophils and monocytes to stimulated endothelium, and also in the phagocytosis of complement coated particles. Multiple transcript variants encoding different isoforms have been found for this gene. [provided by RefSeq, Mar 2009]",Nephropathy,Retinopathy,,,,,,,"1. The expression of the CD11b antigen on the surface of the polymorphonuclear leukocytes is increased in  patients with early diabetic nephropathy (microangiopathy) and diabetic patients  before development vascular complications, suggesting the presence of an increased inflammatory response in these individuals.","1. We conclude that antagonism of CD11b (integrin alphambeta2) by NIF is sufficient to inhibit early stages of diabetic retinopathy, while not compromising the basic immune response.",,,,,,,NA,NA,,,,,
3690,ITGB3,"integrin, beta 3 (platelet glycoprotein IIIa, antigen CD61)","GT,  CD61,  GP3A,  BDPLT2,  GPIIIa,  BDPLT16",17,55444,NA,,11728949,,,,,,,,"The ITGB3 protein product is the integrin beta chain beta 3. Integrins are integral cell-surface proteins composed of an alpha chain and a beta chain. A given chain may combine with multiple partners resulting in different integrins. Integrin beta 3 is found along with the alpha IIb chain in platelets. Integrins are known to participate in cell adhesion as well as cell-surface mediated siglling. [provided by RefSeq, Jul 2008]",Retinopathy,,,,,,,,"1. Genetic polymorphisms of the alpha2beta1 integrin and glycoprotein IIIa (GPIIIa) have been associated with myocardial infarction, stroke, and diabetic retinopathy.",,,,,,,,NA,NA,,,,,
55600,ITLN1,intelectin 1,"HL1,LFR,HL-1,INTL,ITLN,hIntL,omentin",1,111044,NA,,28442700,,,,,,,,NA,Neuropathy,,,,,,,,1. Diabetic foot (DF) is a serious complication of diabetes mellitus (DM) that occurs due to neuropathy or atherosclerosis of the lower limbs.CONCLUSION:The rs2274907 variant of the ITLN1 gene is associated with increased prevalence of DF. ,,,,,,,,NA,Indian,,,,,
3717,JAK2,Janus kinase 2,"JTK10,  THCYT3",9,21033,NA,,20056949,,,,,,,,"This gene product is a protein tyrosine kinase involved in a specific subset of cytokine receptor signaling pathways. It has been found to be constituitively associated with the prolactin receptor and is required for responses to gamma interferon. Mice that do not express an active protein for this gene exhibit embryonic lethality associated with the absence of definitive erythropoiesis. [provided by RefSeq, Jul 2008]",Nephropathy,,,,,,,,"1. Consistent with these in vitro , both albumin protein excretion and phosphorylation of JAK2, STAT1, and STAT3 were attenuated in renal  glomeruli by administration of simvastatin in a streptozotocin-induced rat model  of HG diabetes. This study demonstrates that simvastatin blocks ANG II-induced activation of the JAK/STAT pathway in the diabetic environment, in vitro and in vivo, and, thereby, provides new insights into the molecular mechanisms underlying early diabetic nephropathy.",,,,,,,,Type 2 Diabetes,NA,,,,,
221895,JAZF1,JAZF zinc finger 1,"TIP27, ZNF802",7,18291,NA,,23298195,23298195,,,,,,,"This gene encodes a nuclear protein with three C2H2-type zinc fingers, and functions as a transcriptional repressor. Chromosomal aberrations involving this gene are associated with endometrial stromal tumors. Altertively spliced variants which encode different protein isoforms have been described; however, not all variants have been fully characterized [provided by RefSeq, Jul 2008]",Nephropathy,Cardiovascular,,,,,,,"1. After adjusting for age, gender and body mass index, genetic variants JAZF1 rs864745, FTO rs8050136, and HHEX/IDE rs5015480 were significantly related to reduced estimated glomerular filtration rate (P < 0.05).JAZF1, FTO, CDKAL1, and HHEX/IDE are associated with diabetic nephropahy","1. WFS1, CDKN2A/B, CDC123/CAMK1D, JAZF1, FTO, CDKAL1, and HHEX/IDE are associated with cardiovascular risk.",,,,,,,NA,European,Indian,Japanese,Chinese,,
3766,KCNJ10,potassium voltage-gated channel subfamily J member 10,"KIR1.2,KIR4.1,SESAME,BIRK-10,KCNJ13-PEN",1,1689,NA,,NA,,,,,,,,"This gene encodes a member of the inward rectifier-type potassium channel family, characterized by having a greater tendency to allow potassium to flow into, rather than out of, a cell. The encoded protein may form a heterodimer with another potassium channel protein and may be responsible for the potassium buffering action of glial cells in the brain. Mutations in this gene have been associated with seizure susceptibility of common idiopathic generalized epilepsy syndromes. [provided by RefSeq, Jul 2008]",,,,,,,,,NA,,,,,,,,NA,American,,,,,
