locus_id,Gene,Gene_me,Synonymns,Chro,Homologene,miRNAs,miR.PMIDs,PMID1,PMID2,PMID3,PMID4,PMID5,PMID6,PMID7,PMID8,Gene_summary,theme1,theme2,theme3,theme4,theme5,theme6,theme7,theme8,Obs,Obs2,Obs3,Obs4,Obs5,Obs6,Obs7,Obs8,Drug target,population 1,population 2,population 3,population 4,population 5,population 6
9370,ADIPOQ,"adiponectin, C1Q and collagen domain containing","ACDC,  ADPN,  APM1,  APM-1,  GBP28,  ACRP30,  ADIPQTL1",3,3525,NA,,"17970779 , 23260797","22138143, 26884098","25445230 , 17970779 , 24534238 , 22468045",18191060,25445230,26978180,,,"This gene is expressed in adipose tissue exclusively. It encodes a protein with similarity to collagens X and VIII and complement factor C1q. The encoded protein circulates in the plasma and is involved with metabolic and hormonal processes. Mutations in this gene are associated with adiponectin deficiency. Multiple alternatively spliced variants, encoding the same protein, have been identified. [provided by RefSeq, Apr 2010]",Nephropathy,Cardiovascular,Retinopathy,Atherosclerosis,Neuropathy,Dyslipidemia,,,"1. Serum total adiponectin and HMW adiponectin were found to be positively correlated with the severity of retinopathy and nephropathy but not with neuropathy in T2DM.   	2. These data suggest that the GG genotype at rs2241766 is implicated in the pathogenesis of risk for diabetic nephropathy defined as UACR greater than 30 mg/day in patients with T2DM.","1. It is likely that the G allele of the ADIPOQ G276T polymorphism is a susceptibility allele for CVD in Japanese type 2 diabetic patients, especially when they accompany obesity. 2. SNP of ADIPOQ +276G>T should be related to susceptibility to glucose metabolism, while indirectly to lipid metabolism and fat-related cardiovascular damage.","1. In Asian Indians with type 2 diabetes, serum adiponectin levels are associated with microvascular complications and also with the severity of retinopathy. 2. Serum total adiponectin was found to have increased in the advanced stages of diabetic retinopathy. 3. Adiponectin concentrations are correlated with DR; however, the relationship between adiponectin concentrations and DR needs more in-depth investigations with larger sample sizes.","1. Mutations in different regions of adiponectin gene have been reported to be associated with obesity, atherosclerosis and type 2 diabetes mellitus. A positive association has been found between SNP45 T > G and type 2 diabetes in the study population (P = 0.010, OR = 3.797, 95% CI = 1.312-10.983). Therefore, SNP45T > G in adiponectin gene may be one of the risk factors for type 2 diabetes-This study suggests that the GG genotype at ACDC SNP45 is associated with the presence of CAP and may contribute to atherosclerosis in type 2 diabetes mellitus.","1. Regression analysis revealed adiponectin to be associated with microvascular disease (presence of neuropathy and/or retinopathy and/or nephropathy) (OR1.44, 95% CI1.01-2.06, p=0.049) even after adjusting for age, gender, BMI, HbA1c, diabetes of duration,  serum cholesterol and triglycerides, hypertension and medication status.","1. The risk for MS, T2DM, hyperglycemia, and dyslipidemia is related to  the carriage of the T allele of the G276? polymorphism in the ADIPOQ gene in ethnic Kyrgyz women.",,,NA,Chinese,American,,,,
213,ALB,albumin,"FDAH,  ALBA,  PRO0883,  PRO0903,  PRO1341",4,405,miR-192,26881255,19317217,26388951,1549585,29649417,21489578,31238316,,,"Albumin is a soluble, monomeric protein which comprises about one-half of the blood serum protein. Albumin functions primarily as a carrier protein for steroids, fatty acids, and thyroid hormones and plays a role in stabilizing extracellular fluid volume. Albumin is a globular unglycosylated serum protein of molecular weight 65,000. Albumin is synthesized in the liver as preproalbumin which has an N-terminal peptide that is removed before the nascent protein is released from the rough endoplasmic reticulum. The product, proalbumin, is in turn cleaved in the Golgi vesicles to produce the secreted albumin. [provided by RefSeq, Jul 2008]",Nephropathy,Atherosclerosis,Neuropathy,Retinopathy,Dyslipidemia,Cardiovascular,,,"1. Urinary albumin (ALB) has been measured as a marker for the early detection of diabetic nephropathy.These results indicate that ALB in such patients is susceptible to structural changes due to disease-induced urinary factors and, thus, their urine contains ALB with an altered reactivity to antibody.","1. In addition, inflammatory cytokine levels were decreased only in azelnidipine group  which possibly explains such beneficial effects of azelnidipine on urinary albumin excretion and carotid atherosclerosis.","1. In addition, the PS of gALB isolated from patients with diabetic polyneuropathy was significantly increased (P less than 0.0001) compared to the PS for ALB isolated from the same patients.",1. Insulin therapy and the GA/HbA1c ratio were significant independent variables for diabetic retinopathy.,"1. Multivariate logistic regression analysis demonstrated that independently associated with the reduction in albumin to creatinine ratio (84.8 vs 28.7 ?g/mg creatinine) were amelioration of glycemic control (P < .001), blood pressure (P = .02), dyslipidemia (P = .02), and insulin resistance (P = .05).","1.  We then evaluated the relationship of Î”BWmax-20y with the degree of urinary albumin excretion (UAE), which is a useful marker for CVD.",,,NA,NA,,,,,
335,APOA1,apolipoprotein A-I,apo(a),11,47900,NA,,25470794,18848320,26168996,28934670,18059210,,,,"This gene encodes apolipoprotein A-I, which is the major protein component of high density lipoprotein (HDL) in plasma. The encoded preproprotein is proteolytically processed to generate the mature protein, which promotes cholesterol efflux from tissues to the liver for excretion, and is a cofactor for lecithin cholesterolacyltransferase (LCAT), an enzyme responsible for the formation of most plasma cholesteryl esters. This gene is closely linked with two other apolipoprotein genes on chromosome 11. Defects in this gene are associated with HDL deficiencies, including Tangier disease, and with systemic non-neuropathic amyloidosis. Alternative splicing results in multiple transcript variants, at least one of which encodes a preproprotein. [provided by RefSeq, Dec 2015]",Cardiovascular,Retinopathy,Atherosclerosis,Neuropathy,Dyslipidemia,,,,"1.In conclusion , because various genes, LDLR, CETP, APOA5, Apo E, Apo B, and Apo A-I, are associated with the precipitation of  CAD associated with T2DM, a personalized diet-gene intervention therapy may be advocated to reduce the disease precipitation.",1. ApoA1 overexpression is an early event in the retina of diabetic patients and can be involved in the physiopathology of diabetic retinopathy,"1. cathepsin D-ApoA-I truncation may lead to ApoA-Idelta(1-38) binding to LDLs, increasing their susceptibility to oxidation and contributing to the high cardiovascular risk of DM patients.","1. This study is amid at investigating the associations, and interactions of serum lipid biomarkers with microvascular complications of type 2 diabetes (T2D).[1]Serum triglyceride had the strongest association with microvascular complications of T2D (crude model: ?=0.632, P value=0.045).[2] Despite high density lipoprotein cholesterol (HDL-C), serum apolipoprotein A1 (Apo A1) was positively associated with the presence of diabetic neuropathy.[3]?","1. This increased risk appears to be due to South Asian dyslipidemia, which is characterized by high serum levels of apolipoprotein B, lipoprotein (a), and triglycerides and low levels of apolipoprotein A1 and high-density lipoprotein (HDL) cholesterol.",,,,NA,NA,,,,,
116519,APOA5,apolipoprotein A-V,"RAP3,  APOAV",11,14197,NA,,25470794,25770687,28500476,,,,,,"The protein encoded by this gene is an apolipoprotein that plays an important role in regulating the plasma triglyceride levels, a major risk factor for coronary artery disease. It is a component of high density lipoprotein and is highly similar to a rat protein that is upregulated in response to liver injury. Mutations in this gene have been associated with hypertriglyceridemia and hyperlipoproteinemia type 5. This gene is located proximal to the apolipoprotein gene cluster on chromosome 11q23. Alternatively spliced transcript variants encoding the same protein have been identified. [provided by RefSeq, Oct 2009]",Cardiovascular,Atherosclerosis,Dyslipidemia,,,,,,"1. In conclusion, because various genes, LDLR, CETP, APOA5, Apo E, Apo B, and Apo A-I, are associated with the precipitation of CAD associated with T2DM, a personalized diet-gene intervention therapy may be advocated to reduce the disease precipitation.","1. In a dyslipemic population, genetic variants of APOA5 modulate lipoprotein subclass distributions, inducing an atherogenic profile associated with IMT defined subclinical atherosclerosis.","1. In high cardiovascular risk patients (e.g., patients with metabolic syndrome or type 2 diabetes), APOA5 variants elevate TG levels and shift the entire lipoprotein subclass distribution toward atherogenic dyslipidemia.",,,,,,NA,NA,,,,,
11132,CAPN10,calpain 10,"CANP10,  NIDDM1",2,36323,NA,,15793266,25238846,,,,,,,"Calpains represent a ubiquitous, well-conserved family of calcium-dependent cysteine proteases. The calpain proteins are heterodimers consisting of an invariant small subunit and variable large subunits. The large catalytic subunit has four domainsdomain I, the N-termil regulatory domain that is processed upon calpain activation; domain II, the protease domain; domain III, a linker domain of unknown function; and domain IV, the calmodulin-like calcium-binding domain. This gene encodes a large subunit. It is an atypical calpain in that it lacks the calmodulin-like calcium-binding domain and instead has a divergent C-termil domain. It is similar in organization to calpains 5 and 6. This gene is associated with type 2 or non-insulin-dependent diabetes mellitus (NIDDM), and is located within the NIDDM1 region. Multiple altertive transcript variants have been described for this gene. [provided by RefSeq, Sep 2010]",Atherosclerosis,Dyslipidemia,,,,,,,1. The fact that the diabetes gene CAPN10 also influences the risk for atherosclerosis shows that inherited factors may underlie the frequent co-occurrence of these two conditions.,1. A genetic variant of the CAPN10 gene in Mexican subjects with dyslipidemia is associated with increased HDL-cholesterol concentrations after the consumption of a soy protein and soluble fiber dietary portfolio.,,,,,,,NA,NA,,,,,
1071,CETP,cholesteryl ester tr,"BPIFF,  HDLCQ10",16,47904,NA,,21185205,14608418,27497473,,,,,,"The protein encoded by this gene is found in plasma, where it is involved in the transfer of cholesteryl ester from high density lipoprotein (HDL) to other lipoproteins. Defects in this gene are a cause of hyperalphalipoproteinemia 1 (HALP1). Two transcript variants encoding different isoforms have been found for this gene. [provided by RefSeq, Oct 2013]",Cardiovascular,Atherosclerosis,Dyslipidemia,,,,,,1. Our study suggests that candidate gene polymorphism -629C>A of CETP  may serve as a susceptibility biomarker for CVD in T2DM patients. Analyzing the combined effect of both ACE and CETP genotypes would enhance the sensitivity and  specificity of CVD risk estimation in the T2DM patients in our population,1. increase in CETP under diabetic conditions might be a major factor responsible for increased incidence of diabetes-induced atherosclerosis.,"1. CETP was intimately involved in dyslipidemia-related susceptibility  to cognitive decline, especially memory function in type 2 diabetic patients.",,,,,,NA,Indian,Chinese,,,,
1401,CRP,"C-reactive protein, pentraxin-related",PTX1,1,128039,NA,,21858386,26379442,"20137285, 28420575",26118590,19131463,26379442,,,"The protein encoded by this gene belongs to the pentaxin family. It is involved in several host defense related functions based on its ability to recognize foreign pathogens and damaged cells of the host and to initiate their elimition by interacting with humoral and cellular effector systems in the blood. Consequently, the level of this protein in plasma increases greatly during acute phase response to tissue injury, infection, or other inflammatory stimuli. [provided by RefSeq, Sep 2009]",Nephropathy,Cardiovascular,Retinopathy,Atherosclerosis,Neuropathy,Dyslipidemia,,,"1. Elevated serum MBL in T2DM patients indicated a possible poor diabetic control and bad progression of the disease with possibility of the presence, or development of diabetic nephropathy especially incombination with elevated serum CRP.","1. Our findings emphasize that diabetics were 5.6 times more likely to have high CRP levels than nondiabetics; as CRP is a predictor of cardiovascular disease risk, it can be recognized that diabetics are at more risk of cardiovascular disease than nondiabetics.","1. The serum ischemia modified albumin  (IMA) and hs-CRP concentration were significantly high in DR patients, and were positively associated with the seriousness of DR, which may contribute to the development of DR. 2. The results obtained in the present study indicate that type 2 diabetic patients with higher levels of CRP, TNF- alpha and VEGF were likely to develop diabetic retinopathy, with significant association found in patients with proliferative diabetic retinopathy.","1. Serum hs-CRP levels on admission in patients with acute coronary syndrome (ACS) could predict the severity and complexity of coronary atherosclerosis together with multivessel disease, LVEF, and troponin levels.","1. High levels of C-reactive protein and interleukin (IL)-6 were most consistently associated with diabetic polyneuropathy, high MNSI score, and specific neuropathic deficits, whereas some  inverse associations were seen for IL-18. This study shows that subclinical inflammation is associated with diabetic polyneuropathy and neuropathic impairments. This association appears rather specific because only certain immune mediators and impairments are involved.","1. The high prevalence of obesity among diabetics, together with elevated levels of triglycerides and CRP, suggest coexistence of dyslipidemia and inflammation in diabetes.",,,NA,Chinese,,,,,
1803,DPP4,dipeptidyl-peptidase 4,"CD26,  ADABP,  ADCP2,  DPPIV,  TP103",2,3279,NA,,26821795,26284071,26318108,27816666,27585937,,,,"The protein encoded by this gene is identical to adenosine deaminase complexing protein-2, and to the T-cell activation antigen CD26. It is an intrinsic membrane glycoprotein and a serine exopeptidase that cleaves X-proline dipeptides from the N-terminus of polypeptides. [provided by RefSeq, Jul 2008]",Nephropathy,Cardiovascular,Atherosclerosis,Retinopathy,Dyslipidemia,,,,"1. This study shows that increased DPP4 activities are strongly and independently associated with diabetic nephropathy in type 2 diabetes. The associations between DPP4 and diabetic nephropathy, although strong, do not imply causality.","1. Recently, a novel receptor for soluble DPP4 has been identified, and data are accumulating that the adipokine-related effects of DPP4 may play an important role in the pathogenesis  of cardiovascular disease.",1. This study shows that increased DPP4 activities are positively and independently associated with subclinical atherosclerosis in type 2 diabetes.,1. These findings indicated that serum LECT2 level is negatively associated with the presence of DR and suggest that low circulating LECT2 level is a risk factor for DR.,"1. This is the first study to investigate DPP4 allelic distributions and their association with dyslipidemia in Chinese type 2 diabetes patients, which may have clinical significance.",,,,Type 2 Diabetes,NA,,,,,
1906,EDN1,endothelin 1,"ET1,  QME,  PPET1,  ARCND3,  HDLCQ7",6,1476,NA,,17345061,22409294,"8819510 , 21406182",29849817,10977040,,,,"This gene encodes a preproprotein that is proteolytically processed to generate a secreted peptide that belongs to the endothelin/sarafotoxin family. This peptide is a potent vasoconstrictor and its cognate receptors are therapeutic targets in the treatment of pulmonary arterial hypertension. Aberrant expression of this gene may promote tumorigenesis. Alternative splicing results in multiple transcript variants. [provided by RefSeq, Oct 2015]",Nephropathy,Retinopathy,Neuropathy,Atherosclerosis,Dyslipidemia,,,,"1. In multi-locus analysis, six SNPs exhibited a significant association with DN four SNPs on chromosome 6p (AGER 2184A/G, LTA 252A/G, EDN1 8002G/A and AGER -429T/C) and two SNPs on chromosome 7q (NOS3 774C/T and NOS3 E298D), omnibus p = 0.033.","1. The inflammatory cytokines and angiogenic factors IL1B, IL6, IL8, CCL2, EDN1, VEGF, and TNF are increased in the vitreous of PDR patients without an increase in IL-10. These  add support to the role of inflammatory cytokines and angiogenic factors in the genesis of PDR","1. Thus, the data strongly implicate ET1, acting via ETA receptors in the etiology of neurovascular dysfunction in experimental diabetic neuropathy. 2. In obese subjects, NOS3 4a (P=0.011) had a converse effect to NOS3 894T (P=0.043), and EDN1 8002T (P=0.035) on the prevalence of combined microangiopathy (neuropathy/retinopathy/nephropathy) vs. microangiopathy-negative subjects.","1. Our results revealed that EDN1 rs5370 polymorphism was associated with LAS development both before and after adjustment for atherosclerosis risk factors (sex, age, body mass index, arterial hypertension, type 2 diabetes mellitus, and smoking).",1. Increased plasma levels of endothelin 1 and von Willebrand factor in patients with type 2 diabetes and dyslipidemia.,,,,NA,NA,,,,,
2169,FABP2,fatty acid binding protein 2,"FABPI,  I-FABP",4,107,NA,,16249461,27778448,12161503,,,,,,"The intracellular fatty acid-binding proteins (FABPs) belong to a multigene family with nearly twenty identified members. FABPs are divided into at least three distinct types, mely the hepatic-, intestil- and cardiac-type. They form 14-15 kDa proteins and are thought to participate in the uptake, intracellular metabolism and/or transport of long-chain fatty acids. They may also be responsible in the modulation of cell growth and proliferation. Intestil fatty acid-binding protein 2 gene contains four exons and is an abundant cytosolic protein in small intestine epithelial cells. This gene has a polymorphism at codon 54 that identified an alanine-encoding allele and a threonine-encoding allele. Thr-54 protein is associated with increased fat oxidation and insulin resistance. [provided by RefSeq, Jul 2008]",Nephropathy,Atherosclerosis,Dyslipidemia,,,,,,1. FABP2 confers susceptibility to renal disease in type 2 diabetic patients.,1. CONCLUSIONS: The Thr54 allele of the FABP2 Ala54Thr polymorphism was associated with an increased incidence of peripheral atherosclerosis combined with T2DM in the population studied,"1. In type 2 diabetes, the threonine (Thr) for alanine (Ala) codon 54 polymorphism of the fatty acid binding protein 2 gene is associated with elevated fasting and  postprandial triglycerides and dyslipidemia when compared with the wild type (Ala-54/Ala-54).",,,,,,NA,Japanese,American,,,,
2167,FABP4,fatty acid binding protein 4  adipocyte,"aP2, ALBP, AFABP, A-FABP, HEL-S-104",8,36067,NA,,18305958,20920650,21336983,29305311,18421072,,,,FABP4 encodes the fatty acid binding protein found in adipocytes.  Fatty acid binding proteins are a family of small  highly conserved  cytoplasmic proteins that bind long-chain fatty acids and other hydrophobic ligands. It is thought that FABPs roles include fatty acid uptake  transport  and metabolism. [provided by RefSeq  Jul 2008],Nephropathy,Cardiovascular,Atherosclerosis,Retinopathy,Dyslipidemia,,,,1. we found high serum A-FABP4 but unchanged RBP4 concentrations and their associations with renal function and early diabetic nephropathy in type 2 DM.,1. These findings suggest that FABP4 and FABP5 may represent mediators of and biomarkers for metabolic and cardiovascular disease in type 2 diabetes mellitus.,"1. FABP4 up-regulation is responsible for the enhanced macrophage lipid accumulation by AGE, which may underlie the accelerated formation of foam cells and development of atherosclerotic cardiovascular diseases in diabetic patients.","1. FABP4 shows potential as a novel biomarker for DR prediction in Chinese patients with T2DM, and strict glycaemic control and more frequent retinal examination should be highlighted for T2DM patients with the highest quartile range of FABP4.",1. High FABP4 and low adiponectin levels are independent predictors of  atherogenic dyslipidemia.,,,,NA,NA,,,,,
2171,FABP5,fatty acid binding p,"EFABP,  KFABP,  E-FABP,  P",8,108238,NA,,20920650,20920650,27055964,,,,,,"This gene encodes the fatty acid binding protein found in epidermal cells, and was first identified as being upregulated in psoriasis tissue. Fatty acid binding proteins are a family of small, highly conserved, cytoplasmic proteins that bind long-chain fatty acids and other hydrophobic ligands. FABPs may play roles in fatty acid uptake, transport, and metabolism. Polymorphisms in this gene are associated with type 2 diabetes. The human genome contains many pseudogenes similar to this locus.[provided by RefSeq, Feb 2011]",Cardiovascular,Atherosclerosis,Dyslipidemia,,,,,,1. These findings suggest that FABP4 and FABP5 may represent mediators of and biomarkers for metabolic and cardiovascular disease in type 2 diabetes mellitus.,"1. This study provides evidence for an additive relation of FABP4 and FABP5 with the metabolic syndrome, inflammatory cardiovascular disease risk factors, and corory atherosclerosis in type 2 diabetes mellitus","1. The FABP5 plasma levels were positively correlated with adiposity, glucose metabolism, and lipolysis parameters and were associated with AD, as assessed by NMR.",,,,,,NA,NA,,,,,
26291,FGF21,fibroblast growth factor 21,NONE,19,10428,NA,,"25625802 , 21176857",25425220,26055067,26379627,30641825,,,,"The protein encoded by this gene is a member of the fibroblast growth factor (FGF) family. FGF family members possess broad mitogenic and cell survival activities and are involved in a variety of biological processes including embryonic development, cell growth, morphogenesis, tissue repair, tumor growth and invasion. The function of this growth factor has not yet been determined. [provided by RefSeq, Jul 2008]",Nephropathy,Cardiovascular,Retinopathy,Atherosclerosis,Dyslipidemia,,,,1. Elevated serum FGF21 levels may be a useful  biomarker for predicting kidney disease progression especially in early stages of diabetic nephropathy.    2. Our  suggest that FGF21 improves insulin resistance and protects against renal injury through both improvement of  systemic metabolic alterations and antifibrotic effects in type 2 diabetic nephropathy.,1. Higher baseline plasma FGF21 levels were associated with higher risk of cardiovascular events in patients with type 2 diabetes.,"1. Higher baseline FGF21 levels are seen in patients with type 2 diabetes and established microvascular disease, and predict the future development of new microvascular disease.","1. In humans, circulating FGF21 levels are elevated in corory heart disease and atherosclerosis, and are associated with a higher risk of cardiovascular events in patients with type 2 diabetes.","1. In logistic regression analysis, circulating FGF21 was found to be an independent predictor for subclinical atherosclerosis (P?=?0.023) in addition to dyslipidemia, hypertension and adiponectin.",,,,NA,NA,,,,,
2539,G6PD,glucose-6-phosphate dehydrogenase,G6PD1,X,37906,NA,,21987533,19429815,18385045,27916496,,,,,"This gene encodes glucose-6-phosphate dehydrogenase. This protein is a cytosolic enzyme encoded by a housekeeping X-linked gene whose main function is to produce DPH, a key electron donor in the defense against oxidizing agents and in reductive biosynthetic reactions. G6PD is remarkable for its genetic diversity. Many variants of G6PD, mostly produced from missense mutations, have been described with wide ranging levels of enzyme activity and associated clinical symptoms. G6PD deficiency may cause neonatal jaundice, acute hemolysis, or severe chronic non-spherocytic hemolytic anemia. Two transcript variants encoding different isoforms have been found for this gene. [provided by RefSeq, Jul 2008]",Nephropathy,Cardiovascular,Neuropathy,Retinopathy,,,,,1. This study investigated whether SPR  ameliorates nephropathy by increasing G6PD activity and reducing oxidative stress in spontaneously hypertensive diabetic rats (SHRs).,"1. Thus G6PD may be  a useful therapeutic target for treating the cardiovascular disease associated with type 2 diabetes, if second-generation drugs specifically reducing the activity of G6PD to near normal levels are developed",1. The frequency of G6PD deficiency in patients with NAION was significantly lower than expected.  suggest that G6PD-deficient patients in the Sardinian population have a significantly decreased risk of having NAION.,"1. Poor glycemia levels along with increased generation of ALEs might be the major contributing biochemical derangements associated with decreased G6PD activity followed by low NADPH levels in subjects with MNPDR, thus increasing the vulnerability of erythrocytes to oxidative stress in the early course of retinopathy.",,,,,NA,NA,,,,,
